{
  "object": "organization",
  "id": "example",
  "name": "Acme Corp",
  "slug": "acme-corp",
  "image_url": "example",
  "has_image": false,
  "members_count": 1,
  "missing_member_with_elevated_permissions": false,
  "pending_invitations_count": 1,
  "max_allowed_memberships": 0,
  "admin_delete_enabled": false,
  "public_metadata": {},
  "private_metadata": {},
  "created_by": "example",
  "created_at": 0,
  "updated_at": 0,
  "last_active_at": 0,
  "role_set_key": "example"
}